{
    "DVA.MX": {
        "short_name": "DAVITA INC",
        "long_name": "DaVita Inc.",
        "summary": "DaVita Inc. provides kidney dialysis services for patients suffering from chronic kidney failure or end stage renal disease (ESRD). The company operates kidney dialysis centers and provides related lab services in outpatient dialysis centers. It also provides outpatient, hospital inpatient, and home-based hemodialysis services; owns clinical laboratories that provide routine laboratory tests for dialysis and other physician-prescribed laboratory tests for ESRD patients; and management and administrative services to outpatient dialysis centers. In addition, the company provides disease management services; vascular access services; clinical research programs; physician services; and comprehensive care services. As of December 31, 2019, it provided dialysis and administrative services in the United States through a network of 2,753 outpatient dialysis centers serving approximately 206,900 patients; and operated 259 outpatient dialysis centers located in 10 countries outside of the United States serving approximately 28,700 patients. Further, the company provides acute inpatient dialysis services in approximately 900 hospitals and related laboratory services in the United States. The company was formerly known as DaVita HealthCare Partners Inc. and changed its name to DaVita Inc. in September 2016. DaVita Inc. was founded in 1994 and is headquartered in Denver, Colorado.",
        "currency": "MXN",
        "sector": "Healthcare",
        "industry": "Hospitals",
        "exchange": "MEX",
        "market": "mx_market",
        "country": "United States",
        "city": "Denver"
    }
}